Irish,English
"Cid fil an tra acht marbaiss Cv Chulaind cét fer for cech áth o Ath Scenmenn for Ollbine co Boind m-Breg & comallustar uli na gnima sin dorairngert ind  ingeun & teid slan      iarum conranic Emvin Machai bo deme  in adhaic  sin. Atnagar Eimeur issan Cræbruaidh Concopuir  co maithib Ulad arcenai & ferait failti frie. Boi fer dvaig dotengai  do Ulltaib asstoig .i. Bricne Nemtengai mac Carbad . Conad and ispert side: ‘Bid doilig eim’, ol sé, ‘la Coin Culaind anni do gentar and anocht & an ben tucc laiss a feis la Concopar anocht, ar is less coll cét ingen ria n-Ulltaib dogréss.’ Nu-s-fvassnaigther im Coin Culaind ansin occa cloisstecht sin & nu-s-bertaigenn  co reoimhid  in coilcid boi foi co m-batar a cluma for foluamain immon teuch imacuairt & teid amach lassodain.","Now Cuchulaind killed one hundred on each ford from Ath Scennmend at Ollbine to the Boyne of Bray, and he fulfilled all the deeds that he had vowed to the maiden, and he came safely out of it, and reached Emain Macha towards the darkness of that night. Emer was brought into the    Red Branch to Conchobor and to the men of Ulster, and they bade her welcome. There was a grim evil-tongued man of the men of Ulster in the house, viz., Bricriu of the Venomous Tongue, the son of Arba. It was then he said: ‘Forsooth, it will be disagreeable to Cuchulaind what will happen to-night, viz., the woman whom he brought with him will sleep with Conchobor. For with him is the deflowering of virgins before the men of Ulster ever.’ Cuchulaind grew mad when he heard that, and shook himself so that the cushion burst which was under him, and its feathers were flying about the house. He went out then."
"‘Atá doiligh mor and’, ol Cathfad, ‘acht as geis don rig cen a n-doraid Bricne do denam. Do bithus Cu Chulaind immorro antí foidis  léa mnai’, ol se. ‘Goirther Cu Chulaind dund!’ ol Concvpar, ‘dús an fedfamæis talgadh a brotha.’ Tic iarum Cu Chulaind. ‘Eircc damh’, ol sé , ‘& tuc laut dam evlma failit  a Slep Fvaid.’ Teid iarum Cv Chulaind & nu-s-timaircc leis ina fvair di mucaib & d'aigib alltaib & d'ernvilib gacha fiada folvaimnige olcena i Sleip Fvaid & nu-s-beirr  a n-oinimain leis co m-bvi for faithce na h-Emno. Teidi didiu a fercc lassotain for cvla do Coin Culaind.","‘This is very hard,’ said Cathbad, ‘but it is an ordinance to the king to do everything that Bricriu has said. Cuchulaind will slay him that will sleep with his wife.’ ‘Let Cuchulaind be called to us,’ said Conchobor, ‘to know if we can soothe his wrath.’ Then Cuchulaind came. ‘Arise,’ said Conchobar, ‘and bring me the herds that I have in Slieve Fuait.’ Then Cuchulaind went, and drove together whatever he found in Slieve Fuait of swine and stags, and of every sort of fowl game besides, and drove them in one drove with him to the meadow of Emain. Then his wrath had departed from him."
Do gnitheur imagallaim ic Ulltaib immon caingin sen. Is edh íarmho  comarli irricht leu: Emer do feis la Concobar an adaigh sen & Fercus & Cathfad a n-oinlepaid friv do comhed enich Con Culaind & bennocht Vlad don lanamain ar a fæmadh. Foemaid anni sin & do gníeitheur samlaid. Ícaid Conchubor tinnscrai Emirie íarnamaruch. Do brethai  eniclann do Coin Cvlaind & foidis lia a baincéile & nir' scarsatar  ier suide co fvarutar bas diblinaip.,"A council was held by the men of Ulster about this affair. This was the resolution they arrived at, that Emer was to sleep that night with Conchobor, and Fergus and Cathbad in one bed with them to watch over the honour of Cuchulaind, and the men of Ulster should bless him if he accepted it. He did accept it, and it was done thus. Conchobor paid Emer's wedding gift on the morrow, and Cuchulaind's honour price was paid, and he slept then with his wife, and they did not separate after that until they both died."
"Atnadhar cennacht macraidi Vlad do Coin Cvlaind iarsin. Iss iad sen  robo macrad ind-Emain and inbaid sin, die n-debert an fili oc tabairt a n-anmond oss aird:    Macrad Emno, ailli  sluaig, inbaid batar 'sa  Cræprvaidh,  im Furpaidi, fin in t-slat, im Cumscraid is im Cormac. Am Conaing, im Glasne n-glan, im Fíachaig iss am Findchad, im Coin Culaind cruadach n-gle im mac m-bvadach n-Dechtire . Im Fiachna, im Follamain and, imm Cacht, im Maine, im Illand , im secht Maine a  Sleph in Chon, im Pres, im Nár, im Lothur. Im secht mic Fergusa  ann, im Ilarcless, im Crimtand , im Fiamhain, am Bvidne , am Bri, im Mal claidmech , im Coinri. Lægairi Cas, Conall Clæn, is in da Ethiar ardcæm, Mes Diad iss Mes Deadh  dil, clannv amra Aimirgin . Concraid mac Caiss a Slep Smoil, Concraid mac Baid bernad broin, Conchraid mac an Deirg maic Finn, Concraid Svana mac Salcinn. Aed mac Finderg o Loch Brec , Aed mac Fidaig, formna nert, Aed mac Conaill cirrid cath, Aed mac Duinn, Aed mac Dvach. Fergus mac Leidi, lith n-gle, Fergus mac Deirc maic Daire, Fercus mac Rvis lvaidid rainn, Fercus mac Duib maic Crimthainn. Tri maic Traiglethain trén bladh Sidvath, Currech is Carmon, tri maic ic Uslenn na n-ágh, Noisi, Ainnli is Ardán. Tri Flainn, tri Finn, tri Cuinn civil, anmonn do nói maccaib Scivil, tri Foelain, tri Colla cain, tri mic Neill, tri mic Sithgail. Lon is Iliach, ailli fir, ocus tri Cormaic crithaidh , tri maic Donngaiss mic Rossa , tri Dungaiss, tri Dælgusai. Aess dana do Cormac civil noi mic Lir mic Eterscivil, a tri cuslenna , cain bann , Finn, Eochaid ocus Illann. A cornairi civil iar sin im da Aed is am Fingin , a tri druid denmo glam n-gér Aithirne is Dreuch is Droibel.  A tri dailimain co m-bloid Finn, Iruath is Faitimhain, tri va  Cleitig, comal n-gle, Uath, Uruath iss Aisslinge. Aed, Euchaid airderc Emhno, dá mac ailliu Ilgauhla, mac Bricrenn do bronnad ba airdcrc ic macraid Emna.  conidh e  Tochmarc Emiri ann sin.§","Then the chieftainry of the youths of Ulster was given to Cuchulaind. These were the youths in Emain at that time, about whom the poet spoke, setting forth their names:   The youths of Emain, the fairest host, When they were in the Red Branch, Furbaide—white the rod—with Cuscraid and Cormac. Conaing, Glasni, Glan, Fiachaig, and Findchad, Cuchulaind, hard as steel and bright, the victorious son of Dechtire, Fiachna, Follomain was there, Cacht, Mane, Crimthand, The Seven Manes of Sliab in Chon, Bres, Nar, Lothor, The six sons of Fergus were there, Ilarchless, Illand, Fiamain, Bunne, Bri, Mul, Claidbech, Conri, Laegaire Cass, Conall Claen, and the two Ethers noble and fair. Mesdiad and Mesdedad, the beloved children of Amargen Giunnach, Comchraid the son of Cas, from Sliab Smoil, Conchraid the son of Bad Bernad Broin, Conchraid the son of the Derg, the son of Find, Conchraid Suana the son of Sailcend.  Aed the son of Findderg, Ollach Brec, Aed, the son of Findach, a host of strength, Aed the son of Conall, Cirrid Oath, Aed the son of Dond, Aed the son of Duach, Fergus the son of Lete, a bright festival, Fergus the son of Derg, the son of Dare, Fergus the son of Ross—the verses say—Fergus the son of Dub, the son of Crimthand. The three sons of Traiglethan—strong renown—Siduad, Currech and Carman. The three sons of Uslend of the Battles, Naise and Anle and Ardan, The three Flands, the three Finds, the three Conns of Ciul, the names of the nine sons of Sceol, The three Faelans, the three Colla Cain, the three sons of Niall, the three sons of Sitgal. Lon and Iliach, the most beautiful men, the foster-brothers of Cormac Crichid. The three Dondgas the sons of Mac Rossa, the three Dungas, the three Daelgos. The poets of Cormac Ciul, the nine sons of Lir, son of Eterscel, His three pipers—fair the deed—Find, Eochaid, and Illand. His horn-blowers of music next, the two Aeds and Firgein. Three jesters to make sharp remarks, Athirne and Drec and Drobel. His three distributers of renown, Find, Eruath, aud Fatemain. Three grandsons of Cletech—bright perfection—Uath, Urud and Aslinge. Aed Eochaid, renowned of Emain, the two fair sons of Ilgabla, The son of Bricriu who [...] with the youths of Emain."
Cetri druíd isna cetri cathrachaib-sin. Mórfesae baí a Falias;   Esras boí hi nGorias; Uiscias boí a Findias; Semias baí a Murias. It   íad-sin na cetri filid ocar' foglaindsit Túata Dé fios & éolas.,There were four wizards in those four cities. Morfesa was in Falias; Esras was in Gorias; Uiscias was in Findias; Semias was in Murias. Those are the four poets from whom the Túatha Dé learned occult lore and secret knowledge.
"Tángatar Túad Dé i morloinges mór d'indsaigid Érionn dia gabáil  ar écin for Feraib Bolc. Roloiscset a mbaraca fo cétóir íar  torrachtain críce Corcu Belgatan (.i. Conmaicne mara andíu éat-sen),   cona pedh a n-aire for teiched cucu. Gu rrolíon an déi & an céu tánic  denaib loggaib an ferodn & an áer robo comfocus dóib. Conid as sin  rogabad a tíchtain a nélaip cíach.","The Túatha Dé came with a great fleet to Ireland to take it by force from the Fir Bolg. Upon reaching the territory of Corcu Belgatan (which is Conmaicne Mara today), they at once burned their boats so that they would not think of fleeing to them. The smoke and the mist which came from the ships filled the land and the air which was near them. For that reason it has been thought that they arrived in clouds of mist."
"Baí didiu ben díib láu n-adn oc déicsin an marai & an tíri do tichc  Máoth Scéni .i. Éri ingen Delbaíth; go n-acui an muir fo lánféth amal  ba clár comrédh. A mbuí and íar sin, co n-facai ní: dus-n-árfas ess n-argait  isin fairce. Ba már lee a méd, acht nát arthraigestar a delp díi;  & dobert sruth na tuinde riam decum tírei.","One day one of their women, Ériu the daughter of Delbáeth, was looking at the sea and the land from the house of Máeth Scéni; and she saw the sea as perfectly calm as if it were a level board. After that, while she was there, she saw something: a vessel of silver appeared to her on the sea. Its size seemed great to her, but its shape did not appear clearly to her; and the current of the sea carried it to the land."
"Consernad dóib íarum. Cíich an pen íarum an tan as-n-éracht an  uher.  ‘Cid cíi?’ ol é-sium.  ‘Tátham déde rocoíner,’ ol in bean. ‘Scaradh friut-sa quibindes a  comairnecmar. Maccáema Túath(a) nDéa dom nemét íar mo  cáenghuide & mo ét did-siu amal atom-cota-siu.’","Then they stretched themselves out together. The woman wept when the man got up again. ‘Why are you crying?’ he asked.‘I have two things that I should lament,’ said the woman, ‘separating from you, however we have met. The young men of the Túatha Dé Danann have been entreating me in vain—and you possess me as you do.’"
"‘Níbo hainfes det andísin,’ ol séie. ‘Dit-ánic Elothae mac  Delpaíth rí Fomore. Béra mac diar comruc, & ní tartar ainm dó acht  Eocha Bres (ed ón Eocha Cruthach), ar cech cruthach atcícher a n-Érinn  —eter mag & dún & cuirm & coindeil & ben & fer & ech—is risin  mac-sin dobiter, co n-epérthar ‘as  Bres dó’ ann sin.’","‘You will not remain ignorant of that,’ he said. ‘Elatha mac Delbaith, king of the Fomoire, has come to you. You will bear a son as a result of our meeting, and let no name be given to him but Eochu Bres (that is, Eochu the Beautiful), because every beautiful thing that is seen in Ireland—both plain and fortress, ale and candle, woman and man and horse—will be judged in relation to that boy, so that people will then say of it, ‘It is a Bres.’’"
"Is den cosnam-sin boí eter Túaith Déu, dobreth flaith Érenn don  mac-sin; & dobert .víí. n-aidirie di trénferuib Érenn (.i. a mátri) fri  hasic na flathae úad má fofertis a mífholtae fesin. Dibert a máthair  tír dó íar sin, & don-gnít dún les uaran tír .i. Dún mBrese. Ocus ba hé  an Dagdhae dogéne a ndún-sen.","As a result of that contention which took place among the Túatha Dé, the sovereignty of Ireland was given to that youth; and he gave seven guarantors from the warriors of Ireland (his maternal kinsmen) for his restitution of the sovereignty if his own misdeeds should give cause. Then his mother gave him land, and he had a fortress built on the land, Dún mBrese. And it was the Dagda who built that fortress."
"Ba toirsich dano an Dagdo ocund obair, & atcliched daul esba  isin tech, Cridenbél a ainm, a béolae di suide asa brundie. Ba pec la Crichinphél a cuid fesin & ba már cuid an Dagdae. As inn atbert, ‘A  Dagdae, dot inchaib na trí mírionn bes dech dot chuid tapraither  dom-sae!’ Doberedh íarum an Dagdae dó cech n-oidhche. Máru  immorro a mírionn an cáinte .i. mét degmuce ba hed an mír. Ba trian  immorro de cuid an Dagdhua na trí mírenn-sen. Mesai de bláth an  Dagdhae dinnísin.","Now the Dagda was unhappy at the work, and in the house he used to meet an idle blind man named Cridenbél, whose mouth grew out of his chest. Cridenbél considered his own meal small and the Dagda's large, so he said, ‘Dagda, for the sake of your honor let the three best bits of your serving be given to me!’ and the Dagda used to give them to him every night. But the satirist's bits were large: each bit was the size of a good pig. Furthermore those three bits were a third of the Dagda's serving. The Dagda's appearance was the worse for that."
"Láu n-ann didiu bai an Dagdai isin clad co n-acai an Mac n-Óc  cuige.  ‘Maith sin, a Dagdai,’ or in Mac Óc.  ‘Amin,’ ol in Dagdae.  ‘Cid deghníe drochféthol?’ ol sé.  ‘Táthum a damhnai,’ ol é-sium. ‘Cridenbél cáinte gaphas álgas  dim gacae nónae imna trí mírionn as dech dim cuibrind.’","Then one day the Dagda was in the trench and he saw the Mac Óc coming toward him. ‘Greetings to you, Dagda!’ said the Mac Óc.‘And to you,’ said the Dagda.‘What makes you look so bad?’ he asked.‘I have good cause,’ he said. ‘Every night Cridenbél the satirist demands from me the three best bits of my serving.’"
"Robháoi-siumh amlaidh sin a nGlinn Bolcáin  go rostógaibh uime feacht ann co ráinic Clúain Cilli  a ccoiccrích Thíre Chonaill & Thíre Bóghaine.  Dochuaidh iarumh for  sraith na tiopraidi gur chaith  biorar & uisge ann an oidhche sin. Téit iarumh  a  mbile na cilli. As é ba hoirchinneach isin chill sin  Fáibhlen do muintir Brughaigh mic Deaghaidh &  táinic doinenn mór dermháir ann an oidhche sin gur  rochuir ar Suibhne go mór méd anshóidh na hoidhchi  sin & adbert-somh: ‘Trúagh ámh,’ ar sé, ‘nach  air  Muigh Rath rommharbadh-sa resíu nobheinn isin  deacair-si’; go n-ébairt  an laoidh annso síosana go  léig:","In that wise he remained in Glen Bolcain until at a certain time he raised himself up (into the air) and went to Cluain Cille on the border of Tir Conaill and Tir Boghaine. He went then to the brink of the well where he had for food that night watercress and water. Thereafter he went into the old tree of the church. The erenach of the church was Faibhlen of the family of Brughach, son of Deaghadh. That night there came an exceeding great storm so. that the extent of the night's misery affected Suibhne greatly, and he said: ‘Sad indeed is it that I was not  slain at Magh Rath rather than that I should encounter  this hardship’; whereupon he uttered this lay:"
"Táinic Suibhne roimhe iarumh co riacht an  chill ag Snámh dhá Én for Sionainn, dian comainm  Cluain Boirenn an tan sa; día na haoine dídine an  tsainridh ráinic-siumh annsin. As ann iarumh bádar  cléirigh na cille ag dénamh an uird nóna ocus mná ag  túargain lín & ben ag breth leinb. ‘Nior bhó cóir  éimh,’ ar Suibhne, ‘don mhnáoi aoine an   Choimdedh  do mhilledh. Feibh thúairges an   ben an líon,’ ar  sé, ‘as amhlaidh sin rotúairgeadh mo muinter-sa    isin chath a Maigh Rath.’ Rochúalaidh-sion iarum  clog an esparta aga bhúain, conadh ann adbert:  ‘Ba   binne lem-sa éimh,’ ar sé, ‘guth na ccúach do  chloinsin ar bruach na Banna do gach leith   inás  grig-gráig an chluig si atchluinim   anocht,’ co n-ébert  an laoidh:","So Suibhne fared forth until he reached the church at Snamh dha En on the Shannon, which is now called Cluain Boirenn; he arrived there on a Friday, to speak precisely. The clerics of the church were then fulfilling the office of nones; women were beating flax, and one was giving birth to a child. ‘It is not meet, in sooth,’ said Suibhne, ‘for the women to violate the Lord's fast-day;  even as the woman beats the flax,’ said he, ‘so  were my folk beaten in the battle of Magh Rath.’ He heard then the vesper-bell pealing, whereupon he said:‘Sweeter indeed were it to me to hear the voices of  the cuckoos on the banks of the Bann from every side  than the grig-graig of this bell which I hear to-  night’; and he uttered the lay:"
