Irish,English
"Dorosce Cu Chulaind diuh ulie ocon cliuss ar aine & athlame. Ruscarsad  mna Ulod co mor  ara aine ocon clios, ar atlaime  a leme, ar febas a ergno, ar bindie a erlapra, ar coime a ghnuse, ar sercraide a dreiche. Ar batar secht mec imblesan ina rigroiscoib .i. a cethair isan dalai suil, a tri isan tsuil n-ali  ndo. Secht meoir cechtar a da coss & a secht cechtor a di laime. Batar buado imda foair. Buaid do cedus a gois noco ticced a lon laich , buaid clesomnochtai, buad mbuanfaig, buaid fidceallechtai, buaid n-airdmessai, buaid faidsene, buad crotai. Tri lochtai Con Culaind: a bieth roocc, ar ni rofasotar a rengai rodaim, ar bo moide concesdis oicc anaitnig foir, et a biith rodanai, roaloind.","Cuchulaind surpassed all of them at those feats for quickness and deftness. The women of Ulster loved Cuchulaind greatly for his quickness at the feats, for the nimbleness of his leap, for the excellency of his wisdom; for the sweetness of his speech, for the beauty of his face, for the loveliness of his look. For there were seven pupils in his kingly eyes, four of them in his one eye, and three of them in the other. He had seven fingers on either hand, and seven toes on either of his two feet. Many were his gifts. First, his gift of prudence until his warrior's flame appeared, the gift of feats, the gift of buanfach,6 the gift of draught-playing, the gift of calculating, the gift of sooth-saying, the gift of sense, the gift of beauty. But three faults had Cuchulaind—that he was too young (for his moustache had not grown, and all the more would unknown youths deride him), that he was too daring, that he was too beautiful."
"Boi comairlie lia h-Ultai fodiag Conculaind, ar ruscarsod a man & a n-ingena co mor e, ar ni boi setig a fail Conculaind an tan sen. Ba si comoirli co n-irsad, setig ba  togai la  Coin Culaind de tochmarc ndo, ar bo derb leo conod  lucchaide rosoigfed  millid a n-ingenraide & foemod sercie a mban fer dia mbe  setig a coimfrestoil occo, &  ba soédh  leu mochercrai ocai , corb acobar leo ar an foáth sen toabairt mna ndo, fodég co farcbod comorbo. Ar ro fedatar is vadh bodesin nobíad a athcin .","The men of Ulster took counsel about Cuchulaind, for their women and maidens loved him greatly. For there was no wife with Cuchulaind at that time. This was the counsel, that they would seek a woman whom Cuchulaind might choose to woo. For they were sure that a man who had a wife to attend to him would less ravish their maidens and accept the love of their women. And, besides, they were troubled and afraid that Cuchulaind would perish early, so that for that reason they wished to give him a wife that he might leave an heir; for they knew that his re-birth would be of himself."
Dobreta ierum Conchobor nonbur uad cevca cuiccid a n-Erinn de cungid mna de Coin Culaind dús in faigepdis indach primbaili no primdunod a n-Erinn ingen rig no roflathav no prugad de nech bud ail do togai & de tocmarc n-dou. Tancotor ulie na teachtai diblionoip & ni fuarotar ingen bud  togai la Coin Culaind de tocmarc n-do.,"Then Conchobor sent out nine men into each province of Erinn to seek a wife for Cuchulaind, to see if they would find in any dun or in any chief place in Erinn the daughter of a king, or of a chief, or of a lord of land, whom Cuchulaind might be pleased to choose and woo. All the messengers returned that day a year gone, and had not found a maiden whom Cuchulaind chose to woo."
"Luid Cu Chulaind feisne  de tocmarc ingine ro-s-fitir a l-Luglochtaib Logai, edon Emer inccen Forcoild Monoch . Lod Cu Chulaind feisne & a aræ Læcc mac Riængaprai ina carput. Ass e oencarpat in sin nad foglendis dirmonnoa  na echraidie do cairptib Ulad arodene & áne  in carboid & an errid aridsuided ann.","Thereupon Cuchulaind himself went to woo a maiden that he knew in Luglochta Loga—viz., Emer, the daughter of Forgall the Wily. Then Cuchulaind himself and his charioteer Loeg, son of Riangabar (or Reincobir), went in his chariot. That was the one chariot which the host of the horses of the chariots of Ulster could not follow, on account of the swiftness and speed of the chariot and of who sat in it."
"Forranic Cu Chulaind in ingen ina cluichemag cona comoltaib impe. Ingenai son na m-brugad bautor im Dun Forgaill. Botar side oc foclaind  druine & decclamdai la h-Emir. Is isside ingen pas  fiu lais-sem de ingenoib Erionn do acaldoim & de tochmorc. Ar is isside congaib na sé buadha fuirre .i. buaid crotha & buad n-gothai, buaid m-bindiussai, buaid n-druine, buaid n-goisse, buaid n-gensai. At-bert Cú Chulaind acht ingen pad comadus  n-do ar aois & cruth & cinel & cles & solme, bad deuch lamdai de ingenaib Erenn nad ragad lais & na bad coimdich  n-dou do bancelib Erenn mona beth samlaid. Ar as iside oeningen congepied  na modai sen. Is airie is die tocmarc sainrud lod Cu Chulaind.","Then Cuchulaind found the maiden    on her playing field, with her foster-sisters around her. These were daughters of the lords of land that lived around the dun of Forgall. They were learning needle-work and fine handiwork from Emer. She was the one maiden whom he deigned to address and woo of the maidens of Erinn. For she had the six gifts—viz., the gift of beauty, the gift of voice, the gift of sweet speech, the gift of needle-work, the gift of wisdom, the gift of chastity. Cuchulaind said that no maiden should go with him but she who was his equal in age and shape and race, and skill and deftness, who was the best handworker of the maidens of Erinn, and that none was a fitting wife for him unless such were she. And as she was the one maiden that fulfilled all those conditions, Cuchulaind went to woo her above all."
"Lvid ierum Cu Chulaind co h-airmb i m-boi Scatoig. Do bir a di coiss for da m-bordaib  in clep cliss & nochtaiss in cloideb & do bretha  a rinn fo comair a cride & ispert: ‘Bas h-vassut!’ ol se. ‘To trí drinnroisc dait ’, al si, ‘fep tissed liat anail .’ ‘Gebthar!’ ol Cu Culaind. Fo naisscid uirri iarum. Is ed airmid araili slechta annso, co ruc Cv Culaind Scathaig laiss issan tracht & co comranic frie ann & co ro cotail  ina farrud, conid annsidie ro cachain indí seu oc a taircetul  gach neich  aridbíad, co n-epert: ‘Focen, a scithbvaidnige’ & rl. Acht ni h-airmithir iarsan slicht so sen olceno .","Then Cuchulaind went to the place where Scathach was. He placed his two feet on the two edges of the basket of the cless, and bared his sword, and put its point to her heart, saying: ‘Death over thee!’ said he, ‘Thy three wishes from me!’ said she, viz., ‘thy three wishes as thou canst utter them in one breath,’ ‘They shall be taken,’ said Cuchulaind. He then pledged her. Other versions say here Cuchulaind took Scathach with him to the shore, and lay with her there, and slept with her, and that it was then that she sang this, prophesying to him everything that would befal him, saying: ‘Welcome, oh [...]’ etc. But that is not told thus after this account."
"Foidis Uathach la Coin Culaind & nu-s-forcedlæ Scáthach immon milti  . Isan aimseir sin tra  boi seom la Scathaich & a muinterus h-Uathqu a h-ingene, is and diluid aroili fer aumræ boi la Mumain .i. Lugaid mac Nois mac Alamaic in ri soinemail, coicceli (.i. comalta) Con Cvlaind. Dilligh  indiar & dá errig  deucc imbi  do errigaib  na Muman di tochmarc da n-ingeun dec Níaidhfér maic Rusa.   Arnassa sen di feraib vili remib-seum. An tan iarum ro caula som Forcall Monuch indi sein, forrumai  do Teumraig & ispert fri Lugaid boi oca-seum ind-oentumæ ingen is dech bai ind-Eriu etir cruth & genus & lamdæ. Aspert Lugaid ba maith laiss inn sen. Arnaiss iarum Forculd a ingeun dind rig & da ingin deuc na di m-briugad n-decc olceno uá Breghu den di errig  n-déac botar aræn la Lugaid.","Uathach then slept with Cuchulaind, and Scathach taught him skill of arms. During the time that he was with Scathach and the husband of Uathach, her daughter, a certain famous man who lived in Munster, viz. Lugaid, son of Nos, son of Alamac, the renowned king, and fosterbrother of Cuchulaind, went eastward with twelve chariot-chiefs of the high kings of Munster, to woo twelve maidens of the men of Mac Rossa. All these were betrothed to men before. When Forgall the Wily heard this, he went to Tara, and said to Lugaid that the best maiden in Erinn, both in shape and chastity and handiwork, was living with him unmarried. Lugaid said it pleased him well. Then Forgall betrothed the maiden to the king; and the twelve daughters of the twelve lords of land in Bray besides to the twelve under-kings that were together with Lugaid."
"Dotæt an ri den banfeis ar oen lia Forgauld dia dunat. An tan iarum de brethau Emiur di Lucctith dochum ind ionaid a m-bai oc  s-suidiu for a laim, digabaid si a dá n-gruad. ‘For fior h'oinich & h'anmo daum!’ ol si & adamair  ba Cu Culaind carustar & for a greiss bui & ba coll oinigh cibe do berud isse. Ni forlamair iarum indti Lugaid feis la h-Emir ar omon Con Culaind & imdosæi afritesse dia tigh.","The king went along with Forgall to his dun for the wedding. When now Emer was brought to Lugaid to sit by his side, she took in both her hands his two cheeks, and laid it on the troth of his honour and his life and confessed that it was Cuchulaind she loved, that Forgall was against it, that it was loss of honour for anyone to take her to wife. Then, from fear of Cuchulaind,    Lugaid did not dare to sleep with Emer, and he returned home again."
"Bai cauth for Scathaig dno issan aimsir sene fria tuatai ali & is forra s-side ba banflaith Aifi. Ro tinoilset iarum  cechtarda líno do tabairt in cauthæ, co recht (.i. docenglad) lia Scathaig Cú Chulaind & imdisai ifritesse & debreuth deug suain n-do riam ar na tessed isan cath, ar na rissed ní do ann. Ar choimainmche  do gnith se sein. Do fochrasstar  'diu ellam inti Cv Chulaind assa cotlad iar n-var fochétoir; ar a m-ba mithesse ceteourai n-var fichet do neuc ali din digh svain i cotlad, ba h-oenúar n-dossom innsin.","Scathach was at that time carrying on war against other tribes over which the Princess Aife was ruling. Then the two hosts assembled to fight. Cuchulaind was put in bonds by Scathach, and a sleeping potion had been given him before, that he might not go to the battle lest anything should happen to him there. As a precaution (?) she did this. Then forthwith out of his sleep started Cuchulaind after an hour. While anybody else would have slept twenty-four hours with this sleeping potion, it was only one hour for him."
"Lvid iarum la da mac Scathqu din cath ar cinn trí mac Ilsvanaigh .i. Cuar & Cet & Cruifne iat side trí milid Aifi. Arossanaic sim a tríar a oenur & deceurtar  laiss. Bai dal in catho arnauharuch & do toegat  ín t-slvaig cechtardai co m-batar in da n-idhnæ drech ria dreich. Lotar 'div trí mic Esse Enchinne & Cirí & Birí & Bailcne, trí milid aili di Aiffe & forfvacarsad  comlonn for dá mac Scatqui. Do lotar side for an ted cliss. Fo ceurd Scathach essnaid dissvidi, ar ní fitir cid no piad de. Aill on bad  bith cen in tress feur la da mauc Scathce frisan triar amne & dono ba h-omon  le Aiffe in bainfendig, fodeug is side ba h-annsom bvi issan doman. Lvid 'div Cu Chulaind fria a da mac-si & nu-s-leublaing for an tet & immacomarnic  n-do-ssom friu i tríur & beuhsatar lais.","He then went with the two sons of Scathach against the three sons of Ilsuanach, viz., Cuar and Cett and Cruife, three warriors of Aife's. Alone he met them all three, and they fell by him. There was a meeting in battle on the next morning, and both hosts went until the two arrays were face to face. Then went the three sons of Esse Enchinde, viz. Cire and Bire and Blaicne, three other warriors of Aife, and began combat against the two sons of Scathach. They went on the path of feats. Scathach uttered a sigh at this, for she knew not what would come of it, first, as there was no third man with her two sons against those three and then she was afraid of Aife, because, she was the hardest woman-warrior in the world. Then Cuchulaind went up to her two sons, and sprang on the path, and met them all three, and they fell by him."
"Focraiss Aiffe comlonn  for Scathaig. Lott Cv  Cvlaind ar cinn Aeiffi & iermofoacht qid ba moam serc  bui  aicti riam. Aspert Scathach: ‘Iss ed ba moom serc lei ,’ ol si ‘a dá h-euch & i carpat . ’ Dilotar didiu for in tet cliss Cv Chulaind & Aiffi & fersaid cumleng  fair. Docombai (.i. brissid ) iarum Aiffi a h-airm  for Coin Cvlaind, co na pa sia dornd a claideb. Is ann asmpert  Cu Culaind: ‘Aill amai!’ ol sé, ‘derochair arau  Aiffi & a da h-euch carpait  fon gleun conidnapatar  ulie.’ Decid Aiffi lassotain. Fossdicet Cu Culaind la sotain & gabthus foa dib cichib & dompert  tarsnai amail assclaing , conatulaid gona slvagu bodein Cú Culaind leis h-i , gonratustar  a beim fri talmain dii & do beurt claideb urnocht vasti. Asbert Aifi: ‘Anmoin in anmain, a Cu Chulaind!’ al si. ‘Mo trí drinnrvisc  dam-sa!’ ol se. ‘Ro-t-biad amoil  no tistais lat anail’, or si. ‘It e tri drinnroisc ’, ol sé, ‘giallnæi do Scathaig cen nach frithorgain fria iarum, mvinterus frium d'adaig ar belaibh di dunaicch fen & co rucai mac dam.’ ‘Atmaur-sa amlaid ’, ol si. ‘Digentar airiut  foan innus sin.’ Lvid didiu Cu Chulaind la h-Aeifi & fæidiss  lee in aidqi sin. Asbert  iarum inti Aiffe ba torruch & mac nu-s-berad . ‘Cvirfed-sai 'div dia secht m-bliadan co h-Érin h-e’, ol si, ‘& facaib-se ainm do.’ Facbaiss Cv Chulaind dornnaisc n-oir n-do & ispert frie gon tissad dia cvingid-seum co h-Érinn in tan bvd lan in dornnaisc dia meor & ispert co m-bad é a ainm do bretha n-dov Conlui & aspert frie nacha slonnad  d'oinfir & nacha m-beurad oinfer dia sligid & na rodobad  comlonn ainfir.","Aife challenged Scathach to combat, Cuchulaind went up before Aife, and asked what it was she loved most. Scathach said: ‘What she loves most,’ said she, ‘is her two horses and her chariot and her charioteer.’ Cuchulaind and Aife went on the path of feats and began combat there. Then Aife shattered Cuchulaind's weapon so that his sword was no longer than his fist ‘Ah,’ cried he, ‘the charioteer of Aife and her two horses and her chariot have fallen down in the glen, and have all perished!’ At that Aife looked up. Then Cuchulaind approached her, seized her at her two breasts, took her on his back like a shoulder-load, and carried her with him to his own host. Then he threw her from him to the ground, and placed his bare sword over him. And Aife said: ‘Life for life, oh Cuchulaind!’ ‘My three wishes to me!’ said he, ‘Thou shalt have them, as they come with thy breath,’ said she. ‘These are my three wishes,’ said he, ‘thou to give hostage to Scathach, without ever afterwards opposing her, thou to be with me this night before thy dun, and to bear me a son,’ ‘I promise it all thus,’ said she. It was done in that wise."
"Ataninntai Cv Cvlaind coa muindtir n-iarum fessne & issed tanic, for an tét cétnoi. Co farnoic sentvinn tuathcæich for a cinn  for an teid. Atbert som  fris-som ara forchaine  ar na beth for a cinn iersan teid. Aspert som nad mbvie occo conar diroisevd  acht fon  ald mor ro boi foi. Aidchisi fris an conair do legivd  n-dii. Do lec seum din tet acht giuil a  ladair  aire namaa. A n-dolvid si vassæ fornessæ a ordain di cor den tetd dia chor foan ald. Airiges som dno indni sen & fo cerd ich n-errid n-de svass doridesse & benaiss  a cend din caillig. Ba si sen mathair na tri caurad n-degeunach doceurthur les-sum .i. Ess  Enchine, & fodeicc a admillte-sevm tanaic ar a cind. Do loutar iarum in t-slvaig la Scathaig dia crichaibh feisne & dibrethai gellnai o Aiffi le & anais Cu Culaind denas  taithslainti i fuss.","Thereupon Cuchulaind returned back again to his own people and came along the same road. He met an old woman on the road who was blind of her left eye. She asked him to beware and not be on the road before her. He said there was no room for a footing for him save on the cliff of the sea which was beneath him. She besought him to leave the road to her. Then he left the road except that his toes clung to it. When she passed over him she hit his great toe to throw him off the path down the cliff. He noticed it and leapt the hero's salmon-leap up again, and struck the woman's head off. She was the mother of the three last warriors that had fallen by him, viz., Esse Enchinde, and in order to destroy him had come to meet him."
"O ru-s-scaich iarum de Coin Culaind lanfoglaim in milti do denum la Scathaig etir uballclius & torandcless & foebarcless & foencless & cles cletinech & tetcless & foerclius  & corpcless & cless caid & ich n-errid & corndeliud  & gai bulgai & bai braisse & rothcless & otharcless & cless for analai & brud n-geunai (no gemi ) & sian curad & bem fo commus & taithbeim & fodbeim & dreim fri fogaist co n-dirged creiti for a rinn & carbad serrdhai & fonaidm niadh for rinnib sleg, tainic timgairi do tiachtain dia toig  fesin iarum & timnaiss celiubrad & aspert iarvm Scathach fris iarsen inni arudbai dia forcenn & ro cachain n-do tria h-imus forhossnai, conad ann ispert na priathru sai n-dou.","After the full lore of his soldierly arts with Scathach had passed for Cuchulaind—as well as the apple-feat, the thunder-feat, the blade-feat, the foen-feat, and the spear-feat, the rope-feat, the body-feat, the cat's feat, the salmon-feat of a chariot-chief, the throw of the staff, the jump over [...], the whirl of a brave chariot-chief, the spear of the bellows,37 the boi of swiftness, the wheel-feat, the othar-feat, the breath-feat, the brud geme, the hero's whoop, the blow [...], the counter-blow, running up a lance and righting the body on its point, the scythe-chariot, and the hero's twisting round the    points of spears,—then came a message to him to return to his own land, and he took leave. Then Scathach told him what would befal him in the future, and sang to him in the seer's large shining ken,38 and spake these words:"
"Ticc an ingen den dunad  & ad-fet dia h-athair a      scel n-uli. Tic Cu Culaind den dunad  ierum amail cech n-óigid. Feraid failti fris ierum Conoll & Lægairi. Moidid sochaide issan dun  marbad na Fomóre dano, acht nirro creid and ingen doib. Mosronad  fothraccud don  rig & do breta cach ar uair chuice. Tainic Cu Culaind dno cumai caich & ro rad  an ingen aithne fair. ‘Do-m-beur an ingen dit ’, for Ruad, ‘& icfad fein a tinnscrai.’ ‘Nato’, ol Cu Chulaind. ‘Ticceud dia bliadna imm deugaid-se co h-Érinn mad ail n-di & fogepai messe an.’","The maiden came to the dun and told her father the whole story. Thereafter Cuchulaind came to the dun like every other guest. Then Conall and Loegaire welcomed him. Many in the dun boasted of having killed the Fomori, but the maiden did not believe them. A bath was then prepared by the king, and each one was brought to her separately. Then Cuchulaind came like everybody else, and the maiden recognized him, ‘I shall give the maiden to thee.’ said Ruad, ‘and I shall pay her wedding-gift myself.’ ‘Not so,’ said Cuchulaind. ‘Let her come this day year to Erinn after me, if it be pleasant to her, and she will find me there.’"
"Tanic Cu Chulaind co h-Eamain iartain & at-fed scelai ann. O ro cuir a scis n-de, tanic reme co dunad Forcaill do cuingid Emiri. Bliadain lan n-do oice-ssin & ni roacht ammus fuirre lia h-immad na forairi. Tic iarum cenn  m-bliadna. ‘Iss aniu, a Læig, ro dail-seum  fri ingin Ruaid, acht nad fedamor ind inath airithe , ar ni gæth ro bamar. Tair riunn tra’, ol sé, ‘la h-airiur an tíri.’","Cuchulaind then came to Emain and told his adventures there. When he had cast his fatigue from him, he set out for the rath of Forgall to seek Emer. He was a whole year near it but could not approach her for the number of the watch. He came then at the end of the year, ‘It is to-day, oh Laeg,’ said Cuchulaind, ‘we have our meeting with the daughter of Ruad, but we know not the exact place, for we were not wise. Let us go,’ said he, ‘to the border of the land.’"
"O ro batar la h-aireur Locha Quan iarum at-ciat dá n-en forsan muir. Do m-bert Cu Chulaind cloich issan  tailm & nu-s-dibraicc na h-euna. Reithid an fir cucai iersin iar m-beim andara h-eoin dib. O rancatar ierum , iss ed botar an, da m-bandeilb is cóimhe boi forsan m-bith. Is ed bai ann, Derbforcaill ingen Rvaid & a h-inailt. ‘Is olc in gnim do ronais, a Cu Chulaind!’ ol si. ‘Is tot indsaigid tancamar cia ro-m-cráidis .’ Suidiss Cu Chulaind in cloich esti cona loimb folai imbpe. ‘Ni coimraiceb-sai festai friut’, ol Cu Chulaind, ‘arintibiss  t'fhuil. Do-m-béur cenai dom dalta sunn .i. do Lugaid Reondercc.’ & dignith  samlaid sin.","When they were on the shore of Loch Cuan,42 they beheld two birds on the sea. Cuchulaind put a stone in his sling and aimed at the birds. The men ran up to them after having hit one of the birds. When they came up to them this is what they saw, two women, the most beautiful in the world. These were Derbforgaill, the daughter of Ruad, and her handmaid. ‘Evil is the deed thou hast done, oh Cuchulaind,’ said she. ‘It was to meet thee we came, though thou hast hurt us.’ Cuchulaind sucked the stone out    of her with its clot of blood round it. ‘I shall not wed thee now,’ said Cuchulaind, ‘for I have drunk thy blood. But I shall give thee to my companion here, viz., to Lugaid of the Red Stripes.’ And it was done thus."
"Et bvi Cu Chulaind bliadain doridisi ic saigid dunaid Forcaill & ni rooacht an ingen beus la feupus a coimhetai. Luidie 'diu Cu Chulaind aitherruch do Luglochtaib Logha do dun Forgaill & indiltir in carbat serrgaie les-som in la s-sin & dobreth seul trom foair .i. torannclius trí cét & nonbair & ass e an tress laa ro h-indliodh  in carpat serrgæ do Coin Culaind      & iss airi asmperadh  ona serruib iarnaidib bidis i n-indiull ass, no ona Serdaib tucad  a bunadus ar tos.","Cuchulaind then wanted to go to the rath of Forgall. And the scythe-chariot was prepared for Cuchulaind that day. It was called scythe-chariot (carpat serrda) from the iron scythes that were from it, or again because it was first invented by the Serians."
"Rancatar dunad Forcaill  & fo certt ich n-erred de co m-boi tarna trí lissa  for lar in dúine  & bithais trí bemenn  issan liss co tochair  ochtar cecha beme n-dib & anacht fer i medon cacha nonbuir .i. Scibar & Ipur & Cat, tri braithri Eimere. Fo cerd Forcoll bedc n-de tar  dua na rátha imach  for teiched Con Culaind, cor' tuit  co farcoib cen anmain. To bert Cu Chulaind Eimiur leis cona comdalta cona n-eredaib  d'or & d'airced & fo cerd som bedc de aitherruch tarsan tredua  cona dib n-ingenaib & dotæd reme. Eighteur impe do cach aird. Bid Scenmend foraib. Marbaid Cv Chulaind e  oc a áth, conidh de do garur Áth Scenmenn. Toecaid  assaidi co Glonnath. Marbais Cv Chulaind cét fer n-dib ann. ‘Is mor in glonn do rinis’, ol Emer  ‘in cet fer n-armmach n-incomlainn do marbad.’  ‘Pidh Glonnáth a ainm didiu co bráth olcena ’, or Cu Chulaind.","He then arrived at the rath of Forgall, and jumped the hero's salmon-leap across the three ramparts, so that he was on the ground of the dun. And he dealt three blows in the liss, so that eight men fell from each blow, and one man escaped in the midst of each group of nine, viz., Scibur and Ibur and Cat, three brothers of Emer. Forgall then made a leap on to the rampart of the rath without, in fleeing from Cuchulaind, and he fell and was without life. Cuchulaind took Emer with him and her foster-sister, with their two loads of gold and silver, and took a leap back again across the third rampart with the two maidens and went forth."
"Do roich Cu Chulaind co Crufóid. Ræ ban a ainm co ruici sin . Bentai sium a brathbemendai mora for na slogaib issand inad sin, corro moigseut  na srothai fola tairrsib tar  cech leuth. ‘Is fod cró an telach so laut indiu, a Cu Chulaind!’ ol and ingen. Gonad de sin diráiter Croofoit dii .i. fod cro. To roich in t-iarmoracht forro co h-Ath an Imfoit  for Boinn. Teit Emiur assan carbat. To beir Cv Chulaind tofonn for in toír corro sceinnsit na foit a cru na n-ech tar ath fothuaid. Do beir tafond aili fothuaid co scenndis na foit a cruib  na n-each for ath bódess. Gonad de sin atá Ath n-Imfhoid de dona foitib adiu & anall.","He reached Cru Foit (Blood-turf). Its name was originally Rae-bán (White Field) until then. He dealt great angry blows on the hosts in that place, so that the streams of blood broke over it on each side. ‘The height is a turf of blood through thee today, oh Cuchulaind.’ cried the maiden. So hence it is called Crúfoit, viz., Cró-fót i.e., Turf of Blood. The pursuers overtook them at Ath n-Imfúait on the Boyne. Emer left the chariot. Cuchulaind made a chase on the shore, so that the clods flew from the hoofs of the horses across the ford northward. He made another chase northward so that the clods flew from the hoofs of the horses over the ford southward. Hence it is called Ford of the Two Clods, from the clods hither and thither."
